{
  "format": "neyadanote.recipe",
  "schemaVersion": 1,
  "id": "pork-kimchi-jjigae",
  "locale": "ko-KR",
  "title": "돼지고기 김치찌개",
  "summary": "돼지고기와 잘 익은 김치로 끓이는 기본 돼지고기 김치찌개입니다.",
  "servings": 2,
  "coverImage": "images/cover.webp",
  "tags": [
    "국/찌개",
    "한식"
  ],
  "ingredients": [
    {"name": "잘 익은 김치", "amount": "250g"},
    {"name": "돼지고기 앞다리살", "amount": "150g"},
    {"name": "두부", "amount": "1/2모"},
    {"name": "대파", "amount": "1/2대"},
    {"name": "물", "amount": "500ml"},
    {"name": "고춧가루", "amount": "1큰술"},
    {"name": "국간장", "amount": "1큰술"},
    {"name": "다진 마늘", "amount": "1/2큰술"}
  ],
  "steps": [
    {"id": 1, "description": "김치는 먹기 좋은 크기로 자르고 돼지고기와 두부, 대파를 손질합니다."},
    {"id": 2, "description": "냄비에 돼지고기를 넣고 중불에서 겉면이 익을 때까지 볶습니다."},
    {"id": 3, "description": "김치를 넣고 2~3분 더 볶은 뒤 물을 붓습니다."},
    {"id": 4, "description": "고춧가루, 국간장, 다진 마늘을 넣고 중약불에서 약 15분 끓입니다."},
    {"id": 5, "description": "두부와 대파를 넣고 3~5분 더 끓인 뒤 간을 확인합니다."}
  ]
}
