{
  "format": "neyadanote.recipe",
  "schemaVersion": 1,
  "id": "tuna-kimchi-jjigae",
  "locale": "en",
  "title": "Tuna Kimchi Stew",
  "summary": "A simple kimchi stew made with canned tuna and well-fermented kimchi, with tofu as an optional addition.",
  "servings": 2,
  "coverImage": "images/cover.webp",
  "tags": [
    "Soup/Stew",
    "Korean"
  ],
  "ingredients": [
    {"name": "Well-fermented kimchi", "amount": "250g"},
    {"name": "Canned tuna", "amount": "1 can (135g)"},
    {"name": "Tofu (optional)", "amount": "1/2 block"},
    {"name": "Onion", "amount": "1/4"},
    {"name": "Green onion", "amount": "1/2 stalk"},
    {"name": "Water", "amount": "500ml"},
    {"name": "Korean red pepper flakes (gochugaru)", "amount": "1 tbsp"},
    {"name": "Korean soup soy sauce (guk-ganjang)", "amount": "1 tbsp"},
    {"name": "Minced garlic", "amount": "1/2 tbsp"},
    {"name": "Cooking oil", "amount": "1/2 tbsp"}
  ],
  "steps": [
    {"id": 1, "description": "Cut the kimchi into bite-size pieces and thinly slice the onion. Slice the green onion on a diagonal, and if using tofu, cut it into slices about 1.5cm thick."},
    {"id": 2, "description": "Heat the cooking oil in a pot over medium heat and stir-fry the kimchi and onion for 2 to 3 minutes."},
    {"id": 3, "description": "Add the water, gochugaru, soup soy sauce, and minced garlic. Once it comes to a boil, reduce to medium-low heat and simmer for about 10 minutes."},
    {"id": 4, "description": "Lightly drain the canned tuna, add it to the pot, and stir once or twice so the tuna does not break up too much. Simmer for about 5 more minutes."},
    {"id": 5, "description": "If using tofu, add it with the green onion and simmer for another 3 to 5 minutes. If skipping the tofu, add only the green onion, bring the stew back to a brief simmer, and finish."}
  ]
}
