{
  "format": "neyadanote.recipe",
  "schemaVersion": 1,
  "id": "carbonara",
  "locale": "ko-KR",
  "title": "까르보나라",
  "summary": "구안찰레, 달걀노른자, 페코리노 로마노와 후추로 만드는 로마식 까르보나라입니다.",
  "servings": 2,
  "coverImage": "images/cover.webp",
  "tags": [
    "메인 요리",
    "면요리"
  ],
  "ingredients": [
    {"name": "스파게티", "amount": "180g"},
    {"name": "구안찰레", "amount": "100g"},
    {"name": "달걀노른자", "amount": "3개"},
    {"name": "페코리노 로마노 치즈", "amount": "50g"},
    {"name": "굵게 간 후추", "amount": "1/2작은술 + 마무리용 약간"},
    {"name": "물", "amount": "2L"},
    {"name": "소금", "amount": "2작은술"}
  ],
  "steps": [
    {"id": 1, "description": "냄비에 물 2L를 끓여 소금을 넣고 스파게티를 포장지 권장 시간보다 1분 짧게 삶습니다. 면수 150ml를 덜어 둔 뒤 면을 건집니다."},
    {"id": 2, "description": "구안찰레는 1cm 폭으로 썰어 차가운 팬에 넣고 중약불에서 5~7분 천천히 볶아 지방을 충분히 녹이고 가장자리가 노릇해지게 합니다."},
    {"id": 3, "description": "볼에 달걀노른자 3개, 페코리노 로마노 40g, 후추 1/2작은술을 넣고 걸쭉하게 섞습니다. 남은 치즈 10g은 마무리용으로 둡니다."},
    {"id": 4, "description": "삶은 스파게티를 구안찰레와 녹아 나온 지방이 있는 팬에 넣고 30초 정도 섞은 뒤 팬을 불에서 완전히 내립니다."},
    {"id": 5, "description": "팬을 30초 정도 식힌 뒤 달걀노른자 치즈 혼합물을 넣고 빠르게 섞습니다. 면수를 1큰술씩 2~4큰술 정도 더해 소스가 윤기 나고 면에 부드럽게 달라붙도록 농도를 맞춥니다."},
    {"id": 6, "description": "접시에 담고 남겨 둔 페코리노 로마노와 후추 약간을 뿌려 바로 먹습니다."}
  ]
}
