{
  "format": "neyadanote.recipe",
  "schemaVersion": 1,
  "id": "golden-fried-rice",
  "locale": "en",
  "title": "Golden Egg Fried Rice",
  "summary": "A fluffy, golden Chinese-style egg fried rice adapted for home cooking from Chef Lee Yeon-bok's golden fried rice technique.",
  "servings": 2,
  "coverImage": "images/cover.webp",
  "tags": [
    "Rice Bowl",
    "Chinese"
  ],
  "ingredients": [
    {
      "name": "Microwave-ready rice",
      "amount": "2 packs (210g each)"
    },
    {
      "name": "Eggs",
      "amount": "3"
    },
    {
      "name": "Spam luncheon meat",
      "amount": "50g"
    },
    {
      "name": "Carrot",
      "amount": "1/2 (about 70g)"
    },
    {
      "name": "Scallion",
      "amount": "1/2 stalk (about 40g)"
    },
    {
      "name": "Powdered chicken stock",
      "amount": "2 tsp"
    },
    {
      "name": "Neutral cooking oil",
      "amount": "2 tbsp"
    },
    {
      "name": "Water (to blanch Spam)",
      "amount": "500ml"
    }
  ],
  "steps": [
    {
      "id": 1,
      "description": "Loosen the lids of the rice packs and microwave for about 30 seconds, just enough to make the grains easier to separate."
    },
    {
      "id": 2,
      "description": "Finely dice the Spam, then blanch it in 500ml boiling water for about 30 seconds and drain. Finely chop the carrot and scallion."
    },
    {
      "id": 3,
      "description": "Beat the 3 eggs in a large bowl. Add the briefly warmed rice and use a spatula to break up clumps, coating each grain evenly with beaten egg."
    },
    {
      "id": 4,
      "description": "Mix the carrot, Spam, scallion and powdered chicken stock into the egg-coated rice until evenly distributed."
    },
    {
      "id": 5,
      "description": "Add 2 tablespoons of oil to a skillet and heat over medium heat. Add all of the prepared rice mixture."
    },
    {
      "id": 6,
      "description": "Stir-fry continuously for 4 to 6 minutes, until the eggs are fully cooked and the rice grains are separate and fluffy. Transfer to plates."
    }
  ]
}
