{
  "format": "neyadanote.recipe",
  "schemaVersion": 1,
  "id": "tuna-kimchi-fried-rice",
  "locale": "ko-KR",
  "title": "참치 김치볶음밥",
  "summary": "잘 익은 김치와 참치를 볶아 달걀을 더한 간단한 한그릇요리로, 취향에 따라 김가루를 곁들입니다.",
  "servings": 2,
  "coverImage": "images/cover.webp",
  "tags": [
    "한그릇요리",
    "한식"
  ],
  "ingredients": [
    {"name": "밥", "amount": "400g"},
    {"name": "잘 익은 배추김치", "amount": "200g"},
    {"name": "참치 통조림", "amount": "100g(기름을 뺀 양)"},
    {"name": "달걀", "amount": "2개"},
    {"name": "양파", "amount": "1/4개(약 50g)"},
    {"name": "대파", "amount": "1/2대(약 30g)"},
    {"name": "김치 국물", "amount": "2큰술"},
    {"name": "진간장", "amount": "1큰술"},
    {"name": "설탕", "amount": "1작은술"},
    {"name": "식용유", "amount": "1큰술"},
    {"name": "참기름", "amount": "1작은술"},
    {"name": "김가루", "amount": "2큰술(선택)"}
  ],
  "steps": [
    {"id": 1, "description": "김치는 1~2cm 크기로 썰고 양파는 잘게 다지며 대파는 송송 썹니다. 참치는 체에 밭쳐 기름을 빼고, 달걀 2개는 가볍게 풀어 둡니다."},
    {"id": 2, "description": "중불로 달군 팬에 식용유 1/2큰술을 두르고 달걀을 넣어 크게 저어가며 부드럽게 익힌 뒤 접시에 덜어 둡니다."},
    {"id": 3, "description": "같은 팬에 남은 식용유 1/2큰술을 두르고 대파와 양파를 1분 정도 볶습니다. 김치와 설탕 1작은술을 넣고 김치가 부드러워질 때까지 3~4분 볶습니다."},
    {"id": 4, "description": "밥 400g과 김치 국물 2큰술을 넣어 밥알을 풀어가며 섞습니다. 진간장 1큰술을 팬 가장자리에 둘러 넣고 센불에서 2~3분 볶아 수분을 날립니다."},
    {"id": 5, "description": "기름을 뺀 참치와 미리 익힌 달걀을 넣고 참치가 너무 부서지지 않게 1분 정도 가볍게 섞어 볶습니다."},
    {"id": 6, "description": "불을 끄고 참기름 1작은술을 섞어 그릇에 담습니다. 원하면 김가루 2큰술을 위에 뿌려 마무리합니다."}
  ]
}
