{
  "format": "neyadanote.recipe",
  "schemaVersion": 1,
  "id": "chuncheon-dakgalbi",
  "locale": "en",
  "title": "Chuncheon-style Dakgalbi",
  "summary": "Chuncheon-style spicy stir-fried chicken made with chicken thigh, cabbage, sweet potato, rice cakes, and perilla leaves in a sweet-and-spicy gochujang sauce.",
  "servings": 2,
  "coverImage": "images/cover.webp",
  "tags": [
    "Main Dish",
    "Korean"
  ],
  "ingredients": [
    {"name": "Boneless chicken thigh", "amount": "400 g"},
    {"name": "Cabbage", "amount": "250 g"},
    {"name": "Sweet potato", "amount": "150 g"},
    {"name": "Onion", "amount": "1/2"},
    {"name": "Green onion", "amount": "1/2 stalk"},
    {"name": "Perilla leaves", "amount": "8"},
    {"name": "Korean rice cakes (tteokbokki tteok)", "amount": "120 g"},
    {"name": "Cooking oil", "amount": "1 tbsp"},
    {"name": "Water", "amount": "80 ml"},
    {"name": "Gochujang (Korean red pepper paste)", "amount": "2 tbsp"},
    {"name": "Korean red pepper flakes (gochugaru)", "amount": "1 1/2 tbsp"},
    {"name": "Korean soy sauce (jin-ganjang)", "amount": "1 1/2 tbsp"},
    {"name": "Sugar", "amount": "1 tbsp"},
    {"name": "Cooking wine", "amount": "1 tbsp"},
    {"name": "Minced garlic", "amount": "1 tbsp"},
    {"name": "Curry powder", "amount": "1/2 tsp"},
    {"name": "Sesame oil", "amount": "1 tsp"},
    {"name": "Ground black pepper", "amount": "a pinch"}
  ],
  "steps": [
    {"id": 1, "description": "Cut the chicken thigh into bite-size pieces. Cut the cabbage into 4 to 5 cm pieces and the sweet potato into 5 mm half-moons. Slice the onion thickly, slice the green onion on the diagonal, and cut the perilla leaves into 2 cm strips. If the rice cakes are firm, soak them in cold water for about 10 minutes and drain."},
    {"id": 2, "description": "Mix 2 tbsp gochujang, 1 1/2 tbsp gochugaru, 1 1/2 tbsp soy sauce, 1 tbsp sugar, 1 tbsp cooking wine, 1 tbsp minced garlic, 1/2 tsp curry powder, and a pinch of black pepper to make the sauce."},
    {"id": 3, "description": "Coat the chicken with half of the sauce and let it stand for about 10 minutes."},
    {"id": 4, "description": "Heat a wide pan over medium heat and add 1 tbsp cooking oil. Add the seasoned chicken and sweet potato and stir-fry for about 3 minutes. Add the cabbage, onion, remaining sauce, and 80 ml water, mix well, cover, and cook over medium heat for 5 minutes."},
    {"id": 5, "description": "Remove the lid and continue stir-frying for 5 to 7 minutes, turning the ingredients so they do not stick. Cook until the chicken is fully cooked through and the sweet potato is tender."},
    {"id": 6, "description": "Add the rice cakes and green onion and stir-fry for another 2 to 3 minutes until evenly coated. Continue stir-frying until the sauce lightly coats the ingredients."},
    {"id": 7, "description": "Just before turning off the heat, add the perilla leaves and 1 tsp sesame oil. Toss for about 30 seconds and serve immediately."}
  ]
}
