{
  "format": "neyadanote.recipe",
  "schemaVersion": 1,
  "id": "potato-soup",
  "locale": "ko-KR",
  "title": "감자스프",
  "summary": "감자와 양파를 부드럽게 익혀 우유와 함께 곱게 갈아 만든 담백하고 고소한 감자스프입니다. 취향에 따라 마지막에 트러플 오일을 몇 방울 곁들일 수 있습니다.",
  "servings": 2,
  "coverImage": "images/cover.webp",
  "tags": [
    "국/찌개",
    "양식"
  ],
  "ingredients": [
    {
      "name": "감자",
      "amount": "300g"
    },
    {
      "name": "양파",
      "amount": "1/2개(약 100g)"
    },
    {
      "name": "버터",
      "amount": "15g"
    },
    {
      "name": "물",
      "amount": "250ml"
    },
    {
      "name": "우유",
      "amount": "250ml"
    },
    {
      "name": "소금",
      "amount": "1/2작은술"
    },
    {
      "name": "후추",
      "amount": "약간"
    },
    {
      "name": "트러플 오일(선택)",
      "amount": "1/2작은술"
    }
  ],
  "steps": [
    {
      "id": 1,
      "description": "감자는 껍질을 벗겨 2cm 정도로 썰고, 양파는 굵게 썹니다."
    },
    {
      "id": 2,
      "description": "냄비에 감자와 양파, 물 250ml를 넣고 끓입니다. 끓기 시작하면 약불로 줄여 뚜껑을 덮고 12~15분간, 감자가 쉽게 으깨질 때까지 삶습니다."
    },
    {
      "id": 3,
      "description": "감자와 양파를 건져 한김 식힙니다. 삶은 물은 농도 조절을 위해 조금 남겨 둡니다."
    },
    {
      "id": 4,
      "description": "삶은 감자와 양파에 우유 250ml를 넣고 믹서나 핸드블렌더로 곱게 갑니다."
    },
    {
      "id": 5,
      "description": "갈아 놓은 스프를 냄비에 붓고 버터 15g을 넣습니다. 약불에서 바닥에 눌어붙지 않도록 저으며 한 번 끓어오를 때까지 데운 뒤 소금 1/2작은술과 후추 약간으로 간합니다. 너무 되직하면 남겨 둔 삶은 물을 조금씩 더합니다."
    },
    {
      "id": 6,
      "description": "그릇에 담고 취향에 따라 트러플 오일을 1인분당 몇 방울씩 둘러 마무리합니다."
    }
  ]
}
