{
  "format": "neyadanote.recipe",
  "schemaVersion": 1,
  "id": "tuna-kimchi-jjigae",
  "locale": "ko-KR",
  "title": "참치 김치찌개",
  "summary": "참치와 잘 익은 김치로 간단히 끓이고, 두부를 취향에 따라 더할 수 있는 참치 김치찌개입니다.",
  "servings": 2,
  "coverImage": "images/cover.webp",
  "tags": [
    "국/찌개",
    "한식"
  ],
  "ingredients": [
    {"name": "잘 익은 김치", "amount": "250g"},
    {"name": "참치 통조림", "amount": "1캔 (135g)"},
    {"name": "두부 (선택)", "amount": "1/2모"},
    {"name": "양파", "amount": "1/4개"},
    {"name": "대파", "amount": "1/2대"},
    {"name": "물", "amount": "500ml"},
    {"name": "고춧가루", "amount": "1큰술"},
    {"name": "국간장", "amount": "1큰술"},
    {"name": "다진 마늘", "amount": "1/2큰술"},
    {"name": "식용유", "amount": "1/2큰술"}
  ],
  "steps": [
    {"id": 1, "description": "김치는 먹기 좋은 크기로 자르고 양파는 채 썹니다. 대파는 어슷 썰고, 두부를 넣을 경우 1.5cm 정도 두께로 썹니다."},
    {"id": 2, "description": "냄비에 식용유를 두르고 중불에서 김치와 양파를 2~3분 볶습니다."},
    {"id": 3, "description": "물, 고춧가루, 국간장, 다진 마늘을 넣고 끓기 시작하면 중약불로 줄여 약 10분 끓입니다."},
    {"id": 4, "description": "참치 통조림의 국물을 가볍게 따라낸 뒤 참치를 넣고 너무 부서지지 않게 한두 번 섞어 약 5분 더 끓입니다."},
    {"id": 5, "description": "두부를 넣고 싶다면 두부와 대파를 함께 넣고 3~5분 더 끓입니다. 두부를 넣지 않을 경우 대파만 넣고 한소끔 끓여 마무리합니다."}
  ]
}
